瑞士军刀旅行双肩包男中学生书包电脑背包,149.00,10675人付款,
迪士尼书包小学生男女1-3-4-6年级米奇减负背包儿童书包8-10-12岁,69.00,9591人付款,80658
迪卡侬 户外双肩包女 男 百搭徒步登山包学生书包20L QUECHUA HB,59.00,1453人付款,5122
奥利帝克旅行包女双肩包韩版休闲旅行背包双肩书包中学生男运动包,118.00,958人付款,11786
书包中学生男高中大学生时尚潮流韩版男士背包双肩包男休闲旅行包,59.00,3421人付款,851
2017女士双肩包旅游背包女尼龙超轻户外休闲旅行书包多功能四用包,79.00,660人付款,738
纳尔多双肩包男背包韩版潮商务男士电脑包高中学生书包休闲旅行包,99.00,3227人付款,2423
男士双肩包多功能休闲运动背包电脑包韩版大学生帆布书包时尚潮流,79.00,1104人付款,16063
JanSport杰斯伯双肩包官方正品叛逆学院风书包男女款背包T501纯色,188.00,2113人付款,1864
瑞士军刀双肩包男背包17寸商务电脑包旅行包女韩版休闲中学生书包,128.00,196人付款,197
个性韩版夜光初中学生书包男时尚潮流青年男士背包休闲双肩包女生,39.50,3232人付款,2881
男士双肩包电脑包商务背包男韩版15.6寸14手提大学生方形女书包,138.00,400人付款,5356
双肩包男户外运动登山包超大容量45L60L旅行背包旅游包女学生书包,89.00,457人付款,384
vw 旅游背包男旅行双肩包女电脑运动休闲初中学生书包男时尚潮流,99.00,156人付款,59
佑一良品日本时尚潮流男士双肩包男包韩版休闲旅行背包pu皮质书包,198.00,556人付款,6799
Forever cultivate纯色双肩包女韩版休闲旅行包中学生书包男背包,79.00,693人付款,598
2017新款初中学生书包男大学生男双肩包高中学生背包大容量旅行包,39.00,1121人付款,374
木村原宿新款双肩包女韩版学院风学生书包时尚男士背包休闲旅行包,69.00,259人付款,2910
马可莱登运动背包双肩包男书包中学生男时尚潮流大容量旅游旅行包,148.00,1510人付款,1092
七匹狼男士双肩包 商务旅行包背包防水15.6寸电脑包大学生书包男,189.00,305人付款,520
黛妃洛2017时尚韩版学院风书包潮流双肩包女旅游休闲简约软皮背包,79.00,42人付款,82
双肩包女韩版学院风潮休闲百搭旅行包背包男学生大简约书包中学生,69.00,26人付款,226
2017春夏新款韩版时尚大容量尼龙双肩包女包学生书包休闲旅行背包,29.90,606人付款,614
木村原宿2017新款双肩包女背包男士旅行包韩版潮中学生书包休闲包,59.00,67人付款,799
2016新款韩版潮学院风背包女 大容量简约真皮双肩包 休闲旅行书包,139.00,21人付款,80
2017秋冬新款真皮双肩包女韩版休闲旅行包潮牛皮时尚女士背包书包,158.00,25人付款,42
帆布背包男双肩包韩版潮流时尚大学生书包简约2017新款旅行背包女,62.00,56人付款,30
牛津布配牛皮双肩包女包韩版时尚百搭背包学院风书包休闲妈咪包潮,125.00,98人付款,157
injoylife男士背包简约方形双肩包 真皮复古书包大学生休闲潮黑色,1299.00,10人付款,664
施维茨十字双肩包男士背包女韩版休闲旅行包高中学生书包电脑包潮,159.00,35人付款,183
欧时纳双肩包女包2017新款包包韩版书包休闲背包女学院风双肩背包,199.00,250人付款,382
双肩背包女潮流2016新款韩版百搭旅行休闲时尚大容量女士学生书包,79.00,66人付款,18
新款户外超轻登山双肩背包男骑行防水旅游旅行女时尚学生书包40升,49.00,37人付款,102
森马双肩包女韩版 星星时尚休闲印花学院风大学生书包背包潮专柜,109.00,16人付款,118
尼龙牛津布双肩包女韩版潮百搭个性帆布旅行妈咪包学生书包大背包,98.00,190人付款,258
森马双肩包女韩版字母印花时尚休闲大学生迷你书包背包2016新款潮,119.00,72人付款,240
北包包背包女士双肩包韩版pu皮时尚潮书包日韩简约旅游包2017新款,79.00,455人付款,8183
正品尼龙牛津布黄眼睛恶魔小怪兽双肩包学生书包学院风男女背包潮,116.00,284人付款,438
2016新款韩版潮双肩包女软皮包潮旅行背包休闲水洗皮学院风书包女,72.00,211人付款,501
卡拉羊双肩包女韩版潮小学生书包中学生女大学生休闲背包旅行包,79.00,249人付款,405
木村MCJH春夏旅行双肩包女背包男韩版牙齿纹字母防水书包大中学生,75.00,529人付款,534
牛津布双肩包女韩版潮2017新款百搭学院风学生书包2016尼龙背包,59.00,4546人付款,3412
双肩包女韩版学院风包包2017新款背包女双肩时尚女士休闲女包书包,49.00,2474人付款,4280
超大容量帆布旅行背包男士双肩包女韩版时尚原宿原创个性学生书包,56.00,724人付款,1117
2017新款潮铆钉真皮女包韩版牛皮双肩包女黑色书包休闲旅行小背包,148.00,1289人付款,511
森系小清新束口袋抽绳双肩包 男女纯色帆布背包棉麻布袋书包包邮,16.80,580人付款,418
乐天日本小号双肩包女百搭学院大儿童书包背包大容量情侣亲子款,83.30,199人付款,308
ADDICKES沉迷学习个性搞笑二次元表情学生书包双肩包背包男女夜光,68.00,395人付款,109
休闲运动旅行背包韩版潮中学生书包糖果色轻便双肩包女士防水尼龙,239.00,160人付款,15
牛津布配牛皮双肩包女包韩版时尚情侣背包男包大容量学院风书包潮,109.00,73人付款,200
新款韩版尼龙女式双肩包女包超轻便帆布背包牛津布书包简约妈咪包,188.00,81人付款,419
休闲双肩包男时尚潮流男士背包韩版书包旅行男包PU电脑包包软皮质,128.00,935人付款,214
2016新款多用小清新铆钉双肩包女韩版时尚百搭学院风书包背包包潮,59.00,5129人付款,412
纯色帆布旅游双肩高中生大学生大容量糖果色潮背包男女生电脑书包,35.00,264人付款,611
momogirl双肩包女运动双肩背包初高中学生书包女休闲旅行背包女包,119.00,21人付款,561
牛之骨双肩包男日韩潮流休闲书包中学生男单肩斜跨手提多功能背包,159.00,13人付款,358
anello双肩包日本代购男女帆布学院书包旅行情侣背包包防水电脑包,238.00,124人付款,339
阿能双肩包 女 背包男旅行包旅游学生书包大容量韩版潮包包尼龙,66.00,69人付款,3535
儿童拉杆书包三轮拖拉爬楼梯6-12周岁小学生男孩美国队长双肩背包,85.00,2965人付款,4029
韩版帆布双肩包韩国森系简约中学生书包女校园原宿学院风bf背包潮,33.00,321人付款,64
帆布双肩包小清新书包中学生女韩版校园学院风背包韩国森系大容量,29.90,131人付款,59
DRACONITE男女学生韩版潮民族风几何双肩包旅行电脑背包书包11365,269.00,13人付款,63
韩版休闲男士双肩包旅行多功能电脑背包大学生高中初中开学书包男,59.00,109人付款,15
双肩包男防盗商务电脑包大学生书包男多功能型旅行出差笔记本背包,79.00,45人付款,0
瑞戈瑞士军刀双肩包男女韩版2016新款15寸电脑包商务旅行背包书包,159.00,15人付款,35
时尚双肩包 女 男 潮 权志龙 bigbang 帅气图案背包中小学生书包,69.90,18人付款,9
美国队长3周边 发光钢铁侠3D立体背包头盔造型双肩包潮款学生书包,268.00,8人付款,4
女生包包学院风小清新PU皮书包韩版潮休闲旅行双肩包可爱少女背包,79.00,7人付款,9
时尚潮流男包韩版高中大学生书包女PU皮休闲购物旅行男士双肩背包,49.00,30人付款,60
中小学生花花姑娘儿童女单肩斜挎袋手提袋补习补课包双肩背包书包,18.90,29人付款,15
胜兰2017新款韩版撞色网红大爱旅游背包铆钉鳄鱼纹双肩包女书包,69.00,29人付款,1122
双肩包男背包电脑包韩版休闲男高中学生书包青年旅行包时尚潮流,79.00,14人付款,11
红蜻蜓男包2016新款双肩包欧美学院风书包学生背包旅行包真皮牛皮,289.00,8人付款,23
原宿风双肩包韩版韩国森系校园小清新百搭简约初中高中学生书包女,59.90,28人付款,37
星空印花双肩包女韩版潮旅行背包大中学生书包学院风男休闲电脑包,77.00,7人付款,9
DHH时尚双肩包学院风小型学生书包百搭可爱韩国印花防水布背包潮,78.00,48人付款,14
双肩包女包韩版街头潮女学院风书包韩剧背包朴信惠匹诺曹同款书包,28.90,155人付款,897
新款撞色尼龙女式双肩包女包韩版超轻便牛津布背包书包简约妈咪包,89.00,13人付款,22
专柜正品JanSport T501 9SA SuperBreak双肩包包女背包书包胭脂粉,188.00,3人付款,6
Nike双肩背包中学生书包户外旅行包青少年款男女包透气耐克双肩包,138.00,20人付款,4
